### ISSUE TITLE
Browser loads forever

### ISSUE THREAD

**Issue by tropicbliss** [sammhicks/picoserve#16]
Now this may not be a problem with this library itself but is anyone experiencing infinite loading times in browsers (both Firefox and Chromium based) when it is deployed on the Pi Pico W?

Given the following code:
```rs
#[embassy_executor::task]
async fn web_task(
    stack: &'static embassy_net::Stack<cyw43::NetDriver<'static>>,
    app: &'static picoserve::Router<AppRouter>,
    config: &'static picoserve::Config<Duration>,
) -> ! {
    let mut rx_buffer = [0; 1024];
    let mut tx_buffer = [0; 1024];

    loop {
        let mut socket = embassy_net::tcp::TcpSocket::new(stack, &mut rx_buffer, &mut tx_buffer);

        info!("Listening on TCP:80...");
        if let Err(e) = socket.accept(80).await {
            warn!("accept error: {:?}", e);
            continue;
        }

        info!("Received connection from {:?}", socket.remote_endpoint());

        let (socket_rx, socket_tx) = socket.split();

        match picoserve::serve(app, EmbassyTimer, config, &mut [0; 2048], socket_rx, socket_tx).await {
            Ok(handled_requests_count) => {
                info!(
                    "{} requests handled from {:?}",
                    handled_requests_count,
                    socket.remote_endpoint()
                );
            }
            Err(_) => error!("an error occurred"),
        }
    }
}

async fn get_root() -> impl IntoResponse {
    Response::new(OK, "hello world!").with_headers(("Connection", "close"))
}

fn make_app() -> picoserve::Router<AppRouter> {
    picoserve::Router::new()
        .route("/", get(get_root))
 }
```

The log message shows:
10.986010 INFO  Received connection from Some(192.168.1.6:50968)
└─ wifi_tcp_server::__web_task_task::{async_fn#0} @ src/bin/wifi_tcp_server.rs:86  
15.986416 INFO  0 requests handled from Some(192.168.1.6:50968)
└─ wifi_tcp_server::__web_task_task::{async_fn#0} @ src/bin/wifi_tcp_server.rs:92  
15.986596 INFO  Listening on TCP:80...
└─ wifi_tcp_server::__web_task_task::{async_fn#0} @ src/bin/wifi_tcp_server.rs:80 

If I make the same request with any other HTTP client (e.g., curl) it successfully returns the result perfectly fine and almost immediately. This makes me think that the browser doesn't know when to stop reading the HTTP response or something.

The same server running on the computer works in the browser.

Debugging the problem with Wireshark
Expected (using curl):
[SYN] Seq=0 Win=32120 Len=0 MSS=1460 SACK_PERM=1 TSval=647729354 TSecr=0 WS=128
[SYN, ACK] Seq=0 Ack=1 Win=1024 Len=0 MSS=1460 WS=1 SACK_PERM=1
[ACK] Seq=1 Ack=1 Win=32128 Len=0
GET / HTTP/1.1 
HTTP/1.1 200 
[ACK] Seq=77 Ack=77 Win=32128 Len=0
[FIN, ACK] Seq=77 Ack=77 Win=32128 Len=0
[ACK] Seq=77 Ack=78 Win=1024 Len=0

Found (using Firefox):
[SYN] Seq=0 Win=32120 Len=0 MSS=1460 SACK_PERM=1 TSval=646394589 TSecr=0 WS=128
[SYN] Seq=0 Win=32120 Len=0 MSS=1460 SACK_PERM=1 TSval=646394840 TSecr=0 WS=128
[RST, ACK] Seq=1 Ack=1 Win=0 Len=0
[SYN] Seq=0 Win=32120 Len=0 MSS=1460 SACK_PERM=1 TSval=646394856 TSecr=0 WS=128
[RST, ACK] Seq=1 Ack=1 Win=0 Len=0
[SYN, ACK] Seq=0 Ack=1 Win=1024 Len=0 MSS=1460 WS=1 SACK_PERM=1
[ACK] Seq=1 Ack=1 Win=32128 Len=0

**Comment by tropicbliss** [comment]
Closing because I doubt this is a picoserve issue. Getting error messages like 108.719338 DEBUG === EVENT TXFAIL: EventMessage { version: 2, flags: 0, event_type: 20, status: 2, reason: 0, auth_type: 0, datalen: 0, addr: [a0, 36, bc, 63, dd, 88], ifname: [77, 6c, 30, 0, 0, 0, 0, 0, 0, 0, 0, 0, 0, 0, 0, 0], ifidx: 0, bsscfgidx: 0, }  [] every time i send

**Comment by flyaruu** [comment]
Weird. Browsers are messy things, they tend to do more than you think. Trying to direct you to HTTPS without telling, checking icon files, that sort of thing. Managing to reproduce the issue with a simpler tool like curl or telnet would be helpful. Does an api client tool like Postman work?

**Comment by sammhicks** [comment]
I've added a feature in version 0.6.0 where you can configure if the TCP connection is closed or kept alive after the response has been sent. Does closing the connection after the response has been sent solve the problem?

**Comment by tropicbliss** [comment]
Hi, thanks for looking into this issue. Unfortunately nothing's changed and this is with me using `close_connection_after_response()` and sending the connection: close header. Fortunately, I am only using it as a way of contacting the pico so the fact that using some HTTP client like curl works is good enough for me. The only HTTP client that I've tested that fails to work is the Node.js library axios. fetch() and curl works. Using the same library but not on an embedded device seems to work fine, so this might be an isolated issue with the pico itself, or on other MCUs.

**Comment by sammhicks** [comment]
@tropicbliss To double check, are you able to run the embassy examples (which I've just updated to also include a websocket example)?
